{
  "$schema":"https://json-schema.org/draft/2020-12/schema","$id":"https://ubuddy.invalid/schemas/cp-rir-d2-recovery-fsm-binding-v0.json","type":"object","additionalProperties":false,
  "required":["$schema","schemaVersion","status","caseAlias","scope","sources","expected","evidencePolicy","implementationStatus"],
  "properties":{
    "$schema":{"const":"ubuddy-cp-rir-d2-recovery-fsm-binding-v0.schema.json"},"schemaVersion":{"const":"cp-rir/d2-recovery-fsm-binding/v0"},"status":{"const":"illustrative_v0_draft"},"caseAlias":{"type":"string"},"scope":{"const":"FSM_CANONICAL_BRANCH_EVIDENCE_STEP_RUNTIME_PATH_CATALOG_JOIN_ONLY"},
    "sources":{"type":"object","additionalProperties":false,"required":["canonicalSuite","externalWitness","branchGrammar","branchManifest","recoveryGrammar","recoveryManifest","recoveryEvidence","evidenceStepBinding","runtimeTranscript"],"properties":{"canonicalSuite":{"const":"ubuddy-cp-rir-d2-canonical-suite-v0.input.example.json"},"externalWitness":{"const":"ubuddy-cp-rir-d2-external-branch-witness-v0.input.example.json"},"branchGrammar":{"const":"ubuddy-cp-rir-d2-scheduler-fault-grammar-v0.input.example.json"},"branchManifest":{"type":"string","minLength":1},"recoveryGrammar":{"const":"ubuddy-cp-rir-d2-recovery-fsm-grammar-v0.input.example.json"},"recoveryManifest":{"const":"ubuddy-cp-rir-d2-recovery-fsm-manifest-v0.input.example.json"},"recoveryEvidence":{"type":"string","minLength":1},"evidenceStepBinding":{"type":"string","minLength":1},"runtimeTranscript":{"type":"string","minLength":1}}},
    "expected":{"type":"object","additionalProperties":false,"required":["canonicalCaseDigest","externalWitnessCaseDigest","branchGrammarDigest","branchManifestDigest","recoveryGrammarDigest","recoveryPathSetDigest","recoveryEvidenceDigest","evidenceStepBindingDigest","runtimeTranscriptDigest"],"properties":{"canonicalCaseDigest":{"$ref":"#/$defs/digest"},"externalWitnessCaseDigest":{"$ref":"#/$defs/digest"},"branchGrammarDigest":{"$ref":"#/$defs/digest"},"branchManifestDigest":{"$ref":"#/$defs/digest"},"recoveryGrammarDigest":{"$ref":"#/$defs/digest"},"recoveryPathSetDigest":{"$ref":"#/$defs/digest"},"recoveryEvidenceDigest":{"$ref":"#/$defs/digest"},"evidenceStepBindingDigest":{"$ref":"#/$defs/digest"},"runtimeTranscriptDigest":{"$ref":"#/$defs/digest"}}},
    "evidencePolicy":{"type":"object","additionalProperties":false,"required":["verifiedReceipt","verifiedNegativeWitness","compensationVerified","historicalViolationErasure"],"properties":{"verifiedReceipt":{"const":"INDEPENDENT_EVIDENCE_REQUIRED_NOT_IMPLEMENTED"},"verifiedNegativeWitness":{"const":"INDEPENDENT_EVIDENCE_REQUIRED_NOT_IMPLEMENTED"},"compensationVerified":{"const":"INDEPENDENT_EVIDENCE_REQUIRED_NOT_IMPLEMENTED"},"historicalViolationErasure":{"const":"FORBIDDEN"}}},"implementationStatus":{"const":"prototype/unverified"}
  },"$defs":{"digest":{"type":"string","pattern":"^[a-f0-9]{64}$"}}
}
