{
  "$schema":"ubuddy-cp-rir-d2-recovery-fsm-binding-v0.schema.json","schemaVersion":"cp-rir/d2-recovery-fsm-binding/v0","status":"illustrative_v0_draft","caseAlias":"7Q2P9K4M","scope":"FSM_CANONICAL_BRANCH_EVIDENCE_STEP_RUNTIME_PATH_CATALOG_JOIN_ONLY",
  "sources":{"canonicalSuite":"ubuddy-cp-rir-d2-canonical-suite-v0.input.example.json","externalWitness":"ubuddy-cp-rir-d2-external-branch-witness-v0.input.example.json","branchGrammar":"ubuddy-cp-rir-d2-scheduler-fault-grammar-v0.input.example.json","branchManifest":"ubuddy-cp-rir-d2-scheduler-fault-branch-manifest-v0.input.example.json","recoveryGrammar":"ubuddy-cp-rir-d2-recovery-fsm-grammar-v0.input.example.json","recoveryManifest":"ubuddy-cp-rir-d2-recovery-fsm-manifest-v0.input.example.json","recoveryEvidence":"ubuddy-cp-rir-d2-recovery-evidence-v0.input.example.json","evidenceStepBinding":"ubuddy-cp-rir-d2-recovery-evidence-step-binding-v0.input.example.json","runtimeTranscript":"ubuddy-cp-rir-d2-runtime-sink-transcript-v0.input.example.json"},
  "expected":{"canonicalCaseDigest":"42ebd20134bd2f57d0b3489209b1f6da4abb120df7feb770dd6837b1acf8ccb9","externalWitnessCaseDigest":"14b5d88e8ada2fe96fb6d7753ca25ea03a6cf9034e772d72ee72c6ab100b1c54","branchGrammarDigest":"1be0729d75db72eb82d6cdaff70a74b343333b10410c676faa6b0b3da20b23f4","branchManifestDigest":"d1e9bcccc26796113e0c088dd4348ae68045fb8e7bb5f9b6b2b98ba8ddab9ca8","recoveryGrammarDigest":"ae80205ca52c19cb36cadb86cd2e0815025178a498158fe293a3d6a99f1e5664","recoveryPathSetDigest":"fb381b0fbe0e76d00d7c5b1a6537071cd4d0bdfffa777ac1a6d06697a2be9e12","recoveryEvidenceDigest":"4122213490c35618805a77ff7b62fb833d106f15fe5206d72cb1fdff4ba201fc","evidenceStepBindingDigest":"4cce49a735de794f2a6040a33495b2fad99b07ced06d0fe11be1844ce7d5ebd0","runtimeTranscriptDigest":"19ce78a692245ecedec678861126c0dc83186ab8ee9116bbffebfa214eccdeb2"},
  "evidencePolicy":{"verifiedReceipt":"INDEPENDENT_EVIDENCE_REQUIRED_NOT_IMPLEMENTED","verifiedNegativeWitness":"INDEPENDENT_EVIDENCE_REQUIRED_NOT_IMPLEMENTED","compensationVerified":"INDEPENDENT_EVIDENCE_REQUIRED_NOT_IMPLEMENTED","historicalViolationErasure":"FORBIDDEN"},"implementationStatus":"prototype/unverified"
}
